text	label
Why was I charged a fee for my card payment?	card_payment_fee_charged
I'm not sure why the card payment didn't work.	declined_card_payment
Can I have one of the virtual cards?	getting_virtual_card
Was my transaction reverted with my card?	reverted_card_payment?
I keep checking my statements but nothing shows up! I requested a refund a long time ago but seems it's not reaching my account for some reason. Can you please help me get the money back from the seller for me	Refund_not_showing_up
I am required to make several disposable cards every day.	disposable_card_limits
A transaction I did to my friend hasn't arrived yet, why?	transfer_not_received_by_recipient
$20 came out instead of $100	wrong_amount_of_cash_received
Is a bank transfer acceptable for topping up my account?	transfer_into_account
I think my card payment has been stopped	reverted_card_payment?
Today I was out eating and my card was declined. Why's that?	card_not_working
Can I reset my PIN if it is blocked?	pin_blocked
why hasn't my virtual card come yet?	getting_virtual_card
Can you tell me why my card payment did not work?	declined_card_payment
I need a new Pin how do I go about that?	change_pin
I'd rather not use my physical card, how can I get a virtual card?	getting_virtual_card
They said I would get a refund but I don't see it on my statement.	Refund_not_showing_up
Are there charges for receiving a SEPA transfer?	top_up_by_bank_transfer_charge
The amount of cash I received was not the full amount	wrong_amount_of_cash_received
My transfer failed, why?	failed_transfer
I did a money transaction and dont have a receipt	transfer_not_received_by_recipient
My pin was blocked, how do I make it so I can use it?	pin_blocked
When I was drunk I got my card stuck in your machine because i mis-typed my PIN. What do I need to do to get it restored?	pin_blocked
What can I do to make my physical card work?	card_not_working
I could not use my card in a store.	declined_card_payment
What is the maximum transactions I can use on a disposable card?	disposable_card_limits
Why do I have to give you my drivers license	why_verify_identity
How many disposable cards can I make in a day?	disposable_card_limits
Did a WD earlier at an ATM.  The amount showing in the App is more than I got though.	wrong_amount_of_cash_received
my cash balance less than what I thought	wrong_amount_of_cash_received
My card doesn't accept any transaction at all. What's wrong??	card_not_working
What is the time for a transfer?	transfer_not_received_by_recipient
I didn't get the money I transferred	balance_not_updated_after_bank_transfer
How quickly can I transfer something to China?	transfer_timing
I requested a refund but am unable to see it in my account. Why is that?	Refund_not_showing_up
Can you explain why I am now getting charged a fee for using my card?	card_payment_fee_charged
The transfer on my account is not showing up.	balance_not_updated_after_bank_transfer
Why was I not able to complete my transfer?	failed_transfer
Why would a transfer fail?	failed_transfer
I need to find out why my transfer didn't get there.	transfer_not_received_by_recipient
What is the wait time until money reaches my account?	transfer_timing
Help me create several temp cards every day.	disposable_card_limits
Recipient has not received the money	transfer_not_received_by_recipient
Is there a top up fee for transfer?	top_up_by_bank_transfer_charge
My transfer to my account is missing.	balance_not_updated_after_bank_transfer
I don't have a virtual card - how do I get one?	getting_virtual_card
I am unable to use my card for some reason.	card_not_working
Can I change my PIN in Austria?	change_pin
Tell me how to top up my account using bank transfer.	transfer_into_account
What is the system for determining the exchange rate?	exchange_rate
How long until the transfer is reflected on my account balance?	transfer_timing
I need a new PIN number.	pin_blocked
What is this fee showing up in my account for?	card_payment_fee_charged
My throwaway virtual card won't work	virtual_card_not_working
When will the money from a transfer be made available on my account?	transfer_timing
Please help me in this, as i was unable to make any payment by my new card,  it was getting declined repeatedly. I am not very happy with this incident.	declined_card_payment
What is your opinion on the exchange rate?	exchange_rate
When do you charge fees on accounts? I just saw a charge on my statement.	card_payment_fee_charged
Where do I go to unblock my PIN?	pin_blocked
When will the transaction be done?	transfer_not_received_by_recipient
Can I change my PIN without going to a bank?	change_pin
Why is there a verification to identity	why_verify_identity
Can I add money to my account via bank transfer?	transfer_into_account
I have a missing refund	Refund_not_showing_up
Why can't I get my virtual card to work?	virtual_card_not_working
where do i go to transfer money from one account to this one	transfer_into_account
I have been waiting for my transfer, shouldn't it be here already?	transfer_timing
Why did I get blocked?	pin_blocked
Can I change my PIN at any ATM?	change_pin
Do I need to speak to a representative to change my pin?	change_pin
I requested a refund from a seller a while ago, but when I check my statements it doesn't show up. Can you help me get my refund.	Refund_not_showing_up
My card did not work at store.	declined_card_payment
My money hasn't been transferred yet.	balance_not_updated_after_bank_transfer
Do you know why my card payment has been declined?	declined_card_payment
I've got a problem - I purchased an item maybe a week or two ago, but to the payment came back to my account! I've already got what I ordered, so why are the payment funds showing up in my account?	reverted_card_payment?
|I moved out of my old house two weeks ago and cancelled my direct debit to my old landlord, this direct debit was working fine.  Now I've moved in to a new place and set up a transfer to a new landlord but it's not reached her yet, can you check it please?	transfer_not_received_by_recipient
Why hasn't my friend received the transaction?	transfer_not_received_by_recipient
Will you reinstate my PIN?	pin_blocked
My refund is not showing.	Refund_not_showing_up
Hi, I am new to this. Are there any additional fees or charges that I should be aware of? I was looking through the app and I thought I saw something in regards to fee-free allowances.	card_payment_fee_charged
Why won't the ATM let me withdraw money?	declined_cash_withdrawal
From what countries can I use this product?	country_support
Will you send me a new card in China?	card_about_to_expire
Why is it I am charged an extra fee when I use the ATM?	cash_withdrawal_charge
I deposited a cheque but the cash hasn't arrived yet	balance_not_updated_after_cheque_or_cash_deposit
The incorrect rate was used in my foreign purchase	card_payment_wrong_exchange_rate
My first choice would be Mastercard.	visa_or_mastercard
I can't log into my account because I lost my password	passcode_forgotten
Why was my request for cash declined?	declined_cash_withdrawal
Um, my top up didn't work	top_up_failed
My statement shows an extra fee - what is it?	extra_charge_on_statement
The disposable cards, what are they for?	get_disposable_virtual_card
I want this amount reversed out of my account.	request_refund
Can I top up with cash	top_up_by_cash_or_cheque
Can I update my details?	edit_personal_details
I finished my transfer. I am having an issue with it still pending. It has been a long time and i'm growing impatient	pending_transfer
Is it possible to get both Mastercard and Visa card from you?	visa_or_mastercard
Since I just got married I need to change my name.	edit_personal_details
I received the wrong exchange rate for an item i bought.	card_payment_wrong_exchange_rate
can I transfer my salary if it's in a different currency?	receiving_money
What currency is acceptable for a top up?	supported_cards_and_currencies
Am I permitted to have a spare card?	getting_spare_card
I have some transactions on my account I did not make. Can you cancel my card and prevent further use.	compromised_card
Any hidden fees associated with the international card if money is added?	top_up_by_card_charge
What do you charge for an exchange fee?	exchange_charge
I just looked at my app and it seems I was charged extra, why is that?	extra_charge_on_statement
Help! In the app there is a payment that I don't remember.	card_payment_not_recognised
Will the system automatically top up itself?	automatic_top_up
Is there a reason my top-up has not gone through?	pending_top_up
Help!  There is a cash withdrawl on the account that I didn't make!	cash_withdrawal_not_recognised
can i get a card if i live in the US?	country_support
I need a disposable virtual card, how do I get one?	get_disposable_virtual_card
hello I have lost my phone and I'm worried someone's going to steal money from me	lost_or_stolen_phone
What are the top up charges for US cards?	top_up_by_card_charge
I would like to change currency	exchange_via_app
How do I get money from an ATM using my card? I can't seem to get it to work? I used the pin I had, but maybe it's wrong? What do I need to do to fix this?	declined_cash_withdrawal
I made a mistake this morning when I did a transfer. How do I reverse it?	cancel_transfer
Hey I thought transfers were free.  Why are you charging me?	transfer_fee_charged
Why hasn't my payment gone through?	pending_card_payment
Do I have to pay for a physical card?	order_physical_card
I can't verify my ID. Why?	unable_to_verify_identity
Can I activate a card in the app?	card_linking
The ATM kept my card?	card_swallowed
Where can I find your locations?	country_support
There's a cash withdrawal I am certain I did not make	cash_withdrawal_not_recognised
Is there anything I need to do since my phone was stolen?	lost_or_stolen_phone
What can I use to receive my salary?	receiving_money
when will my transfer clear	pending_transfer
I was at an ATM and it swallowed my card.	card_swallowed
Can I change my information?	edit_personal_details
I wanted to use my contactless at the metro today but it didn't accept it!	contactless_not_working
I got my new card. How do I activate it?	activate_my_card
Is the 1 pound charge going to be reimbursed on my card?	extra_charge_on_statement
What do you charge for top ups?	top_up_by_card_charge
I just got a card, how can I add it to the app?	card_linking
Can I use a check to top up?	top_up_by_cash_or_cheque
What are the top-up fees?	top_up_by_card_charge
My transfer is still pending	pending_transfer
My top up isn't in my wallet.	topping_up_by_card
I bought something in a foreign currency but the rate applied is wrong!	card_payment_wrong_exchange_rate
What is a pending cash withdrawal?	pending_cash_withdrawal
Can I use my card for payment all over the world?	card_acceptance
I was trying to use contactless earlier, but it didn't work.	contactless_not_working
What card types can I choose from?	visa_or_mastercard
Please help me delete this account.	terminate_account
why isnt my cash withdrawal showing	pending_cash_withdrawal
I was made to pay an additional pound!	extra_charge_on_statement
I do not recognise this card payment.	card_payment_not_recognised
Why isn't top-up working? My top-up money disappeared after I saw that it was successfully transferred. Is it gone? Where did it go?	top_up_reverted
Next time maybe let people know that buying things from another country costs extra. I used my card to purchase an item from another country and I was charged for the item and also an extra fee it looks like. I wasnt aware of this and I think I should get a refund.	transfer_fee_charged
Can I have it delivered on a specific date?	card_delivery_estimate
Why are the things I bought earlier today still showing as pending?	pending_card_payment
I want to know why I have been unable to withdrawn funds.	declined_cash_withdrawal
Can I change my details because I moved?	edit_personal_details
totally unacceptable.  I'm stranded with no cash because the ATM wouldn't give me any money!	declined_cash_withdrawal
How can I tell if someone else is using my card?	compromised_card
Is it normal to have to wait over a week for my new card?	card_arrival
The ATM machines keep declining my card and I don't know why. I thought I had money in my account. Why is this happening?	declined_cash_withdrawal
Why hasn't my withdrawal shown on my statement?	pending_cash_withdrawal
Why isn't my balance updating after depositing cheques and cash.	balance_not_updated_after_cheque_or_cash_deposit
I have a transaction showing up more than once.	transaction_charged_twice
I can't use the app because I got mugged yesterday and they took everything. Please help.	lost_or_stolen_phone
My card is lost!  Please help me!	lost_or_stolen_card
Will a beneficiary not accept a transfer?	beneficiary_not_allowed
There has been an unusual withdrawal from my account, can you help?	cash_withdrawal_not_recognised
I relocated and need to change my personal details.	edit_personal_details
The wrong account was used during a transaction.	cancel_transfer
I am unhappy with my purchase, how do I cancel the order?	request_refund
ATM still has my card	card_swallowed
Can you assist on apple watch top ups?	apple_pay_or_google_pay
There is a direct debit charge that I don't recognize, what can I do?	direct_debit_payment_not_recognised
Am I able to return an item for a refund?	request_refund
I see money go out that I didn't withdraw.	cash_withdrawal_not_recognised
What do I do to close my account?	terminate_account
Seems like my top-up has failed	top_up_failed
I've lost track of my phone or someone stole it.	lost_or_stolen_phone
How long can an EU transfer take?	pending_transfer
How old do kids have to be to open an account?	age_limit
How come a fee was charged when I tranferred money	transfer_fee_charged
How come I got charged extra for withdrawing cash?	cash_withdrawal_charge
I tried to use the ATM today but it would not accept my card.	declined_cash_withdrawal
How can I find the nearest ATM?	atm_support
I received my new card, how is it activated?	activate_my_card
I should not have been charged a fee for cash withdrawal.	cash_withdrawal_charge
Where can i top my card for free?	top_up_by_card_charge
do i need to add money before i order a card	order_physical_card
There is a record of payment I never submitted on the app.	card_payment_not_recognised
Help, my phone was stolen, please advise!	lost_or_stolen_phone
There is a duplicate payment on my card. Why?	transaction_charged_twice
I am having trouble verifying my identity.	unable_to_verify_identity
When will my transfer finish pending?	pending_transfer
How can I tell if my top-up has been cancelled?	top_up_reverted
What do I do if there is an electronic debit that is not correct?	direct_debit_payment_not_recognised
Where's the money that got charged to my card? It's not showing up in my account balance	topping_up_by_card
Can I use a cheque to top up my account	top_up_by_cash_or_cheque
My card hasn't arrived.	card_arrival
Why did I have to pay a fee when I got cash?	cash_withdrawal_charge
Help!  I forgot my password.	passcode_forgotten
I need my funds verified.	verify_source_of_funds
What are the auto top-up policies?	automatic_top_up
My money hasn't been deposited yet. When will it be?	pending_top_up
I deposited cash this morning and I am still waiting	balance_not_updated_after_cheque_or_cash_deposit
Which fiat currencies are supported?	fiat_currency_support
The app doesn't believe its me.	unable_to_verify_identity
Why am I charged a fee for withdrawing cash?	cash_withdrawal_charge
Are there any top-up limits?	top_up_limits
What is the youngest age for an account?	age_limit
Can I let other people have access to my account in order to top up?	topping_up_by_card
I thought transfers were free, why was I charged a fee?	transfer_fee_charged
How do I get a new card as your machine swallowed mine!	card_swallowed
I have lost my card! What is my next step?	lost_or_stolen_card
Cash I didn't get shows in my app.	cash_withdrawal_not_recognised
Yesterday I topped up my card. Why didn't it complete as it still pending?	pending_top_up
I need assistance with understanding which fiat currencies that you support.	fiat_currency_support
I want a refund on a direct debit.	direct_debit_payment_not_recognised
tell me how I can order my card.	order_physical_card
I received my American Express card, but I am having problems making it work with Apple pay.  Can you help me with this problem?	apple_pay_or_google_pay
Where can the cards be delivered?	order_physical_card
My card is missing!  Help!	lost_or_stolen_card
How do I verify my identity online	verify_my_identity
I want a refund for an item	request_refund
How long is the delivery time to the US?	card_delivery_estimate
There are transactions that I did not make on my account, I think someone has my information.	compromised_card
Do you provide currency exchange to Euros?	fiat_currency_support
What are the places that you deliver cards to?	order_physical_card
When will my pending payment finish?	pending_card_payment
Can I set the account to auto top-up?	automatic_top_up
how can i track card you sent	card_arrival
Why hasn't my payment shown up yet?	pending_card_payment
Why is there a fee on my money transfer?	transfer_fee_charged
I want to delete my account.	terminate_account
How do I exchange AUD for GBP?	exchange_via_app
Why can't I verify my id?	unable_to_verify_identity
Has my top-up been cancelled?	top_up_reverted
While I was checking out in the grocery store, I realized I needed cash so I requested some.  However, I noticed there was a fee for this transaction.  Why did I get charged a fee?	cash_withdrawal_charge
Can I use top-up with Apple pay?	apple_pay_or_google_pay
I see a direct debit that isn't mine? How can I get my money back?	direct_debit_payment_not_recognised
How do I order a new card if my current one is about to expire?	card_about_to_expire
My withdrawal is pending, why?	pending_cash_withdrawal
What do I need to know about topping up?	top_up_by_card_charge
I have my card, when whill my PIN be available?	get_physical_card
I don't know what's going on but all of my transfers keep getting declined. I have checked over the recipient details twice. These details are all correct.	declined_transfer
This is the first time I've tried to get my money out of an ATM and it didn't work. Please give me my money	declined_cash_withdrawal
Are you only able to get a card if you're in the UK?	country_support
Is my new card activated?	activate_my_card
I made a payment that got charged twice instead of once.	transaction_charged_twice
Is there a specific date i can have it delivered?	card_delivery_estimate
What does it mean when a payment is pending?	pending_card_payment
A foreign purchase I made has the incorrect rate applied to it.	card_payment_wrong_exchange_rate
What fees to you have for top ups?	top_up_by_card_charge
How do I activate a card I received?	activate_my_card
I need to set up an account for my daughter, how would I do that?	age_limit
What is the verification code for my top up card?	verify_top_up
I need to get some Euros for my holiday. Am I able to exchange some of my money?	exchange_via_app
I bought a product a week ago, but may need to return it.	request_refund
There is a single payment on my card which shows as pending.	pending_card_payment
I have a card that was deactivated can I reactivate it?	card_linking
My transfer hasn't appeared yet	pending_transfer
I prefer Visa, can I get that instead?	visa_or_mastercard
How can I fix my card, it got declined twice.	declined_transfer
Are the top-ups limited?	top_up_limits
Is it possible to get one the your cards in the EU?	country_support
I was under the impression that you offer crypto top up; however,  it doesn't appear to be working. The money has now disappeared from my account so I need to know what the deal is?	top_up_reverted
my cash out is still pending	pending_cash_withdrawal
Why hasn't my balance been updated? I've deposited a few cheques some days ago!	balance_not_updated_after_cheque_or_cash_deposit
Help Me!  I lost my card.  What should I do?	lost_or_stolen_card
I might be paranoid, but someone may be using my card.	compromised_card
Every ATM I visit is rejecting my card and I don't know why. There should be money on it. Can you check it to see if something is wrong or if I'm doing something wrong?	declined_cash_withdrawal
Where is the closest Mastercard ATM?	atm_support
I accidentally left my phone at the hotel so now I'm not able to use the app.	lost_or_stolen_phone
The exchange rate is bad. Are you sure this is the exchange rate?	card_payment_wrong_exchange_rate
If I order a card when does it arrive?	card_delivery_estimate
Can I see my available money?	verify_source_of_funds
I need to terminate my account immediately.	terminate_account
How can I know where did my funds come from?	verify_source_of_funds
I have a trip coming up and want to add money automatically.	automatic_top_up
I am trying  to  transfer and  it has been  stopped why is  that	beneficiary_not_allowed
Can I freeze my card right now?	compromised_card
Where are the cards delivered to	order_physical_card
Do I have to pay for exchanging currencies?	exchange_charge
How to receive the actual card	order_physical_card
I used my card to top up, but the money is not there!	topping_up_by_card
My top-up didn't go through	top_up_failed
I tried to make a cash withdrawal and it was declined. Why did this happen?	declined_cash_withdrawal
I bought an item at the wrong exchange rate.	card_payment_wrong_exchange_rate
got married and need to change name	edit_personal_details
Top up is not working even though I have my AMEX in apple pay.	apple_pay_or_google_pay
I can't use the app because I got mugged yesterday and they took everything. I need some help.	lost_or_stolen_phone
I need you to delete my account now.	terminate_account
I was charged a fee for my transfer.	transfer_fee_charged
There is a pending payment on my account, what does this mean?	pending_card_payment
Hi i received an error message informing me about the transaction failure. I have done the money transfer before and it never failed. Please let me know what is the issue this time.	beneficiary_not_allowed
For some reason my contactless won't work for me.	contactless_not_working
My transaction went through but I was charged a fee. Why?	transfer_fee_charged
A cash withdrawal that I didn't authorize is shown on my account - can you please cancel my card as soon as possible?	cash_withdrawal_not_recognised
Why is my payment still pending?	pending_card_payment
Your service is bad.  Close my account.	terminate_account
how do i get a refund for a direct debit payment i didn't make	direct_debit_payment_not_recognised
I am still waiting for a the cash I deposited this morning	balance_not_updated_after_cheque_or_cash_deposit
When should I expect to receive my card?	card_delivery_estimate
I believe my card has been compromised as there are funds showing that I did not receive.	cash_withdrawal_not_recognised
stolen phone, what should i do	lost_or_stolen_phone
Is it normal to have to verify my top-up or is something wrong?	verify_top_up
The card PIN?	get_physical_card
Can I space out how often money is transferred along my travels?	automatic_top_up
Please can you block the transaction I just sent from my account? It was a payment but I accidently typed in the wrong details and think it might have gone to the wrong place.	cancel_transfer
What are the benefits of a disposable card?	get_disposable_virtual_card
I need a Visa and a Mastercard from you.	visa_or_mastercard
Do I need to order a new card before it expires?	card_about_to_expire
Why hasnt my top up gone through yet?? I thought it was suppose to be instant? Am I wrong? Why is it still pending?	pending_top_up
I got some cash of an ATM earlier but this shows up as pending in the app. How can this be still pending, I've got the cash already?	pending_cash_withdrawal
I can't enter my passcode.	passcode_forgotten
I am getting continuous failure for all my transfers. I have cross checked each recipient detail again and again and everything is correct.	declined_transfer
If I exchange currencies frequently, is there a discount?	exchange_charge
Why was my cash withdrawal declined?	declined_cash_withdrawal
Will I be able to use my card anywhere?	card_acceptance
I got mugged yesterday and lost access to the app. I need to regain it.	lost_or_stolen_phone
Is there a reason for my top up to be cancelled?	top_up_reverted
Why hasn't my cash arrived from a deposited check?	balance_not_updated_after_cheque_or_cash_deposit
The exchange rate I was charged for a purchase was not right.	card_payment_wrong_exchange_rate
I have been charged twice on my statement.	transaction_charged_twice
Why did I get charged more than once?	transaction_charged_twice
Why is a payment showing up on my card as pending?	pending_card_payment
There is a suspicious cash withdraw on the account.	cash_withdrawal_not_recognised
Can I use the system Google Pay for top-ups?	apple_pay_or_google_pay
I don't appreciate the extra fees being siphoned from my account. I was helping some friends move to Japan and we were buying home decorations at the local stores. The  receipts differed greatly from what showed up in my bank account and my statement. When can I expect the extra fees to be back in my account?	transfer_fee_charged
I'd like to delete my account.	terminate_account
I don't live in the UK.  Can I still get a card?	country_support
Hello, I tried to top up with my card, but it didn't work. I just got it a couple days before and it works fine. What's the deal? Can you check into this?	top_up_failed
my card was not in the mail again can you advise?	card_delivery_estimate
What do I need to do to change the address on my account?	edit_personal_details
What does the 1 fee mean?	extra_charge_on_statement
